{"schema":"scenereplay.style/1.0","id":"lowpoly/japanese-town","baseStyle":"","palette":{"entries":[{"role":"ground","color":{"r":0.22,"g":0.28,"b":0.2,"a":1.0}},{"role":"stone","color":{"r":0.34,"g":0.37,"b":0.38,"a":1.0}},{"role":"stone.dark","color":{"r":0.19,"g":0.22,"b":0.23,"a":1.0}},{"role":"plaster","color":{"r":0.82,"g":0.76,"b":0.62,"a":1.0}},{"role":"timber","color":{"r":0.22,"g":0.1,"b":0.045,"a":1.0}},{"role":"roof","color":{"r":0.08,"g":0.12,"b":0.15,"a":1.0}},{"role":"paper","color":{"r":0.92,"g":0.83,"b":0.65,"a":1.0}},{"role":"shrine.red","color":{"r":0.72,"g":0.075,"b":0.045,"a":1.0}},{"role":"lantern","color":{"r":1.0,"g":0.42,"b":0.08,"a":1.0}},{"role":"fabric.red","color":{"r":0.62,"g":0.08,"b":0.06,"a":1.0}},{"role":"fabric.indigo","color":{"r":0.08,"g":0.18,"b":0.38,"a":1.0}},{"role":"foliage","color":{"r":0.16,"g":0.42,"b":0.18,"a":1.0}},{"role":"blossom","color":{"r":0.95,"g":0.48,"b":0.62,"a":1.0}}]}}