{"schema":"scenereplay.style/1.0","id":"lowpoly/workbench","baseStyle":"","palette":{"entries":[{"role":"wood.primary","color":{"r":0.5,"g":0.24,"b":0.07,"a":1.0}},{"role":"wood.secondary","color":{"r":0.28,"g":0.11,"b":0.025,"a":1.0}},{"role":"metal.dark","color":{"r":0.08,"g":0.1,"b":0.12,"a":1.0}},{"role":"metal.accent","color":{"r":0.82,"g":0.3,"b":0.05,"a":1.0}},{"role":"ceramic","color":{"r":0.12,"g":0.55,"b":0.62,"a":1.0}},{"role":"light","color":{"r":1.0,"g":0.72,"b":0.18,"a":1.0}}]}}